{
  "type": "object",
  "additionalProperties": false,
  "properties": {
    "event_id": {
      "type": "string",
      "format": "uuid"
    },
    "type": {
      "const": "ReservaSolicitada"
    },
    "schema_version": {
      "const": 1
    },
    "occurred_at": {
      "type": "string",
      "format": "date-time"
    },
    "correlation_id": {
      "type": "string",
      "format": "uuid"
    },
    "causation_id": {
      "anyOf": [
        {
          "type": "string",
          "format": "uuid"
        },
        {
          "type": "null"
        }
      ]
    },
    "prestamo_id": {
      "type": "string",
      "format": "uuid"
    },
    "payload": {
      "type": "object",
      "additionalProperties": false,
      "properties": {
        "producto_id": {
          "type": "string",
          "format": "uuid"
        },
        "cantidad": {
          "type": "integer",
          "minimum": 1,
          "maximum": 100
        }
      },
      "required": [
        "producto_id",
        "cantidad"
      ]
    }
  },
  "required": [
    "event_id",
    "type",
    "schema_version",
    "occurred_at",
    "correlation_id",
    "causation_id",
    "prestamo_id",
    "payload"
  ],
  "$schema": "https://json-schema.org/draft/2020-12/schema",
  "title": "ReservaSolicitada"
}
