{
  "event_id": "55555555-5555-4555-8555-000000000001",
  "type": "ReservaSolicitada",
  "schema_version": 1,
  "occurred_at": "2026-10-18T15:00:00Z",
  "correlation_id": "44444444-4444-4444-8444-444444444444",
  "causation_id": null,
  "prestamo_id": "11111111-1111-4111-8111-111111111111",
  "payload": {
    "producto_id": "22222222-2222-4222-8222-222222222222",
    "cantidad": 1
  }
}
